{
  "$schema": "https://json-schema.org/draft/2020-12/schema",
  "$id": "https://github.com/tonoizer/module-federation-doctor/schemas/report.schema.json",
  "title": "MFDoctor report",
  "type": "object",
  "required": ["schemaVersion", "capabilities", "summary", "findings"],
  "properties": {
    "schemaVersion": { "const": 1 },
    "capabilities": {
      "type": "object",
      "required": [
        "config",
        "sourceImports",
        "manifest",
        "stats",
        "emittedAssets",
        "installedVersions"
      ],
      "properties": {
        "config": { "type": "boolean" },
        "sourceImports": { "type": "boolean" },
        "manifest": { "type": "boolean" },
        "stats": { "type": "boolean" },
        "emittedAssets": { "type": "boolean" },
        "installedVersions": { "type": "boolean" }
      },
      "additionalProperties": false
    },
    "status": {
      "description": "Additive run completeness. Always written by current reporters; optional when reading older reports. incompleteReasons is empty when complete is true.",
      "type": "object",
      "required": ["complete", "incompleteReasons"],
      "properties": {
        "complete": { "type": "boolean" },
        "incompleteReasons": {
          "type": "array",
          "items": {
            "type": "string",
            "enum": [
              "missing-emit",
              "missing-stats",
              "partial-bundler",
              "probe-skipped",
              "evidence-unknown"
            ]
          }
        }
      },
      "additionalProperties": false
    },
    "summary": {
      "type": "object",
      "required": ["projects", "info", "warnings", "errors"],
      "properties": {
        "projects": { "type": "integer", "minimum": 0 },
        "info": { "type": "integer", "minimum": 0 },
        "warnings": { "type": "integer", "minimum": 0 },
        "errors": { "type": "integer", "minimum": 0 },
        "suppressed": { "type": "integer", "minimum": 0 },
        "score": {
          "description": "Offline unique-rule health score, or null when analysis is too partial.",
          "oneOf": [{ "type": "integer", "minimum": 0, "maximum": 100 }, { "type": "null" }]
        },
        "scoreLabel": {
          "description": "Actionable label for score; may be stricter than the numeric band, or null when score is null.",
          "oneOf": [{ "type": "string", "enum": ["Great", "OK", "Needs work"] }, { "type": "null" }]
        }
      },
      "additionalProperties": false
    },
    "findings": {
      "type": "array",
      "items": {
        "type": "object",
        "required": [
          "schemaVersion",
          "ruleId",
          "severity",
          "message",
          "project",
          "evidence",
          "fingerprint"
        ],
        "properties": {
          "schemaVersion": { "const": 1 },
          "ruleId": { "type": "string", "minLength": 1 },
          "severity": { "enum": ["info", "warning", "error"] },
          "message": { "type": "string" },
          "project": { "type": "string" },
          "federationInstanceId": {
            "type": "string",
            "pattern": "^mfid:v1:federation-instance:[a-f0-9]{24}$"
          },
          "location": {
            "type": "object",
            "required": ["path"],
            "properties": {
              "path": { "type": "string" },
              "line": { "type": "integer", "minimum": 1 },
              "column": { "type": "integer", "minimum": 1 }
            },
            "additionalProperties": false
          },
          "evidence": { "type": "object" },
          "suggestion": { "type": "string" },
          "documentation": { "type": "string" },
          "fingerprint": { "type": "string", "minLength": 1 },
          "detailsSchema": { "type": "string", "minLength": 1 },
          "details": { "type": "object" },
          "suppressed": { "type": "boolean" },
          "suppressionReason": { "type": "string" }
        },
        "additionalProperties": false
      }
    }
  },
  "additionalProperties": false
}
