{
  "capabilities": {
    "config": true,
    "emittedAssets": false,
    "installedVersions": true,
    "manifest": false,
    "sourceImports": true,
    "stats": false
  },
  "findings": [
    {
      "details": {
        "entry": "http://cdn.example.com/remoteEntry.js",
        "remote": "shop"
      },
      "detailsSchema": "remotes.config.v1",
      "documentation": "/rules/config/js-remote-without-type-urls",
      "evidence": {
        "alias": "shop",
        "entry": "http://cdn.example.com/remoteEntry.js",
        "remote": "shop"
      },
      "fingerprint": "fc6adef144644fd46794d3d5f4ffe757a461927bd48b541633d5cb2aee1703cb",
      "message": "Remote \"shop\" points at a .js entry while dts consumeTypes is on and remoteTypeUrls does not cover it.",
      "project": "@mfdoctor-showcase/remote-http-insecure",
      "ruleId": "config/js-remote-without-type-urls",
      "schemaVersion": 1,
      "severity": "warning",
      "suggestion": "Point the remote at `mf-manifest.json` so type URLs come from the manifest, or set `dts.consumeTypes.remoteTypeUrls` for this remote."
    },
    {
      "details": {
        "entry": "http://cdn.example.com/remoteEntry.js",
        "remote": "shop"
      },
      "detailsSchema": "remotes.config.v1",
      "documentation": "/rules/config/remote-http-insecure",
      "evidence": {
        "entry": "http://cdn.example.com/remoteEntry.js",
        "name": "shop"
      },
      "fingerprint": "aad0eafc068fda2276d500d41467e3aff6e518386627d6d6f1803602c6d19e7d",
      "message": "Remote \"shop\" uses plain HTTP outside localhost.",
      "project": "@mfdoctor-showcase/remote-http-insecure",
      "ruleId": "config/remote-http-insecure",
      "schemaVersion": 1,
      "severity": "warning",
      "suggestion": "Use HTTPS so remote code cannot be changed in transit."
    }
  ],
  "schemaVersion": 1,
  "status": {
    "complete": false,
    "incompleteReasons": ["missing-emit"]
  },
  "summary": {
    "errors": 0,
    "info": 0,
    "projects": 1,
    "score": 99,
    "scoreLabel": "Great",
    "warnings": 2
  }
}
