{
  "capabilities": {
    "config": true,
    "emittedAssets": true,
    "installedVersions": true,
    "manifest": true,
    "sourceImports": true,
    "stats": false
  },
  "findings": [],
  "schemaVersion": 1,
  "status": {
    "complete": true,
    "incompleteReasons": []
  },
  "summary": {
    "errors": 0,
    "info": 0,
    "projects": 1,
    "score": 100,
    "scoreLabel": "Great",
    "warnings": 0
  }
}
