{
  "capabilities": {
    "config": true,
    "emittedAssets": false,
    "installedVersions": true,
    "manifest": false,
    "sourceImports": true,
    "stats": false
  },
  "findings": [
    {
      "details": {
        "missing": [],
        "workspaceDiagnostics": [
          {
            "files": ["host/src/index.ts"],
            "kind": "stale",
            "message": "Project evidence is stale: source input \"src/index.ts\" is newer than project facts."
          }
        ]
      },
      "detailsSchema": "doctor.partial-analysis.v1",
      "documentation": "/rules/doctor/partial-analysis",
      "evidence": {
        "workspaceDiagnostics": [
          {
            "files": ["host/src/index.ts"],
            "kind": "stale",
            "message": "Project evidence is stale: source input \"src/index.ts\" is newer than project facts."
          }
        ]
      },
      "fingerprint": "695c86328ba256cb66e444429655fb01d238a72796c664b28d05002b31df8f22",
      "message": "mfdoctor found workspace diagnostics; analysis is incomplete.",
      "project": "workspace",
      "ruleId": "doctor/partial-analysis",
      "schemaVersion": 1,
      "severity": "warning",
      "suggestion": "When MF options are missing, pass them explicitly. On Vite, missing `mf-manifest.json` / `mf-stats.json` usually means enable `manifest: true`, not missing options; an explicit `manifest: false` is reported by `artifact/manifest-disabled` instead. On Webpack/Rspack/Rsbuild, remotes with `capabilities.stats` false after emit is incomplete (`missing-stats` on `status.incompleteReasons`, or this rule): those bundlers emit stats by default (`manifest !== false`). Fix source permissions or transient read races when `imports.sourceReadFailures` is present, or raise the analysis budget when only a budget cutoff made the workspace `partial`. Prefer string-literal dynamic imports or an opt-in runtime trace when analysis is incomplete."
    }
  ],
  "schemaVersion": 1,
  "status": {
    "complete": false,
    "incompleteReasons": ["missing-emit", "evidence-unknown"]
  },
  "summary": {
    "errors": 0,
    "info": 0,
    "projects": 2,
    "score": null,
    "scoreLabel": null,
    "warnings": 1
  }
}
